{
  "$schema": "https://json-schema.org/draft/2020-12/schema",
  "$id": "predit://artifacts/publish_log",
  "type": "object",
  "additionalProperties": true,
  "properties": {
    "outputs": {
      "type": "array",
      "items": {
        "$schema": "https://json-schema.org/draft/2020-12/schema",
        "$id": "predit://artifacts/publish_log.output",
        "type": "object",
        "additionalProperties": false,
        "properties": {
          "path": {
            "type": "string"
          },
          "kind": {
            "type": "string"
          },
          "platform": {
            "type": "string"
          },
          "notes": {
            "type": "string"
          }
        },
        "required": [
          "path"
        ]
      }
    },
    "metadata": {
      "type": "object",
      "additionalProperties": true
    },
    "source_manifest_path": {
      "type": "string"
    },
    "captions_path": {
      "type": "string"
    },
    "notes": {
      "type": "array",
      "items": {
        "type": "string"
      }
    }
  },
  "required": [
    "outputs"
  ]
}
